tcpdump -n -i eth0

20:38:09.883763 IP 165.22.230.167.22 > 99.232.18.89.54746: Flags [P.], seq 61936:62092, ack 37, win 501, length 156
20:38:09.883907 IP 165.22.230.167.22 > 99.232.18.89.54746: Flags [P.], seq 62092:62248, ack 37, win 501, length 156
20:38:09.883993 IP 165.22.230.167.22 > 99.232.18.89.54746: Flags [P.], seq 62248:62440, ack 37, win 501, length 192
20:38:09.884089 IP 165.22.230.167.22 > 99.232.18.89.54746: Flags [P.], seq 62440:62692, ack 37, win 501, length 252
20:38:09.884177 IP 165.22.230.167.22 > 99.232.18.89.54746: Flags [P.], seq 62692:62832, ack 37, win 501, length 140
20:38:09.899006 IP 99.232.18.89.54746 > 165.22.230.167.22: Flags [.], ack 62832, win 2047, length 0
20:38:09.987734 IP 165.22.230.167.22 > 99.232.18.89.54746: Flags [P.], seq 62832:62988, ack 37, win 501, length 156
20:38:09.987844 IP 165.22.230.167.22 > 99.232.18.89.54746: Flags [P.], seq 62988:63592, ack 37, win 501, length 604
20:38:09.987889 IP 165.22.230.167.22 > 99.232.18.89.54746: Flags [P.], seq 63592:63628, ack 37, win 501, length 36
20:38:09.998290 IP 99.232.18.89.54746 > 165.22.230.167.22: Flags [.], ack 63628, win 2044, length 0
20:38:10.091784 IP 165.22.230.167.22 > 99.232.18.89.54746: Flags [P.], seq 63628:63784, ack 37, win 501, length 156
20:38:10.091925 IP 165.22.230.167.22 > 99.232.18.89.54746: Flags [P.], seq 63784:64060, ack 37, win 501, length 276
20:38:10.091986 IP 165.22.230.167.22 > 99.232.18.89.54746: Flags [P.], seq 64060:64200, ack 37, win 501, length 140
20:38:10.106389 IP 99.232.18.89.54746 > 165.22.230.167.22: Flags [.], ack 64200, win 2042, length 0
20:38:10.195752 IP 165.22.230.167.22 > 99.232.18.89.54746: Flags [P.], seq 64200:64356, ack 37, win 501, length 156
20:38:10.195856 IP 165.22.230.167.22 > 99.232.18.89.54746: Flags [P.], seq 64356:64632, ack 37, win 501, length 276
20:38:10.195916 IP 165.22.230.167.22 > 99.232.18.89.54746: Flags [P.], seq 64632:64772, ack 37, win 501, length 140
20:38:10.209812 IP 99.232.18.89.54746 > 165.22.230.167.22: Flags [.], ack 64632, win 2047, length 0
20:38:10.259647 IP 99.232.18.89.54746 > 165.22.230.167.22: Flags [.], ack 64772, win 2047, length 0
^C
439 packets captured
446 packets received by filter
0 packets dropped by kernel
